id;categories;visible;mainpage;order;date;title_it;title_en;title_fr;articleUrl;video_type;video_id;video_src;thumbnail_url;thumbnail_fallbackGradient
strange-fish-nominated-at-visioni-dal-mondo-festival;documentary-films;VERO;VERO;21;17/07/2018;Strange Fish nominato al festival Visioni dal Mondo;Strange Fish nominated at Visioni dal Mondo Festival;Strange Fish nommé au festival Visioni dal Mondo;http://www.nawartpress.com/?p=4003;vimeo;277282627;;http://www.nawartpress.com/wp-content/uploads/2018/07/alloro_arancione-300x206.png;linear-gradient(135deg, #E5DDD4 0%, #FAF8F5 100%)
strange-fish-film-e-prossime-date;documentary-films;VERO;VERO;24;25/01/2019;Strange Fish, film e prossime uscite;Strange Fish, documentary movie and next screenings;Strange Fish, documentaire et prochaines sorties;https://www.raiplay.it/video/2019/08/Doc-3-Strange-Fish-73a3ecf5-8c72-4a2e-be28-ad11df3fd987.html?fbclid=IwAR1aHrAeM_-Q2xYJckRBgA-DrIeUPPQQWbyrBeBKmvtBwVBTsMYyOnq7jUg#;vimeo;299668760;;;linear-gradient(135deg, #E5DDD4 0%, #FAF8F5 100%)
english-video-migrants-tragedy-overwhelms-greek-island-of-lesvos;migration-displacement;VERO;VERO;11;10/06/2015;Migrants tragedy overwhelms Greek island of Lesvos - Middle East Eye;Migrants tragedy overwhelms Greek island of Lesvos - Middle East Eye;Migrants tragedy overwhelms Greek island of Lesvos - Middle East Eye;http://www.middleeasteye.net/news/video-migrants-targedy-overwhelms-greek-island-lesvos-76206394;youtube;3DrirVgP04E;;http://www.middleeasteye.net/sites/default/files/styles/main_image_article_page/public/main-images/Lesvos.jpg;linear-gradient(135deg, #E5DDD4 0%, #FAF8F5 100%)
senza-vie-legali-in-tunisia-si-diventa-harraga;migration-displacement;VERO;VERO;17;29/11/2017;Senza vie legali, in Tunisia si diventa “harraga”;Senza vie legali, in Tunisia si diventa “harraga”;Senza vie legali, in Tunisia si diventa “harraga”;http://www.nawartpress.com/?p=3767;youtube;6gYBXRwsDjY;;;linear-gradient(135deg, #E5DDD4 0%, #FAF8F5 100%)
essere-un-travestito-a-tirana;documentary-films;VERO;;9;20/05/2015;Essere un travestito a Tirana;Essere un travestito a Tirana;Essere un travestito a Tirana;http://www.nawartpress.com/?p=1367;youtube;6mPPmazIzcA;;;linear-gradient(135deg, #E5DDD4 0%, #FAF8F5 100%)
made-in-tunisia-women-textile-workers-resist-poor-working-conditions;longform-reportage;VERO;VERO;15;03/06/2016;Made in Tunisia: Women textile workers resist poor working conditions;Made in Tunisia: Women textile workers resist poor working conditions;Made in Tunisia: Women textile workers resist poor working conditions;http://www.nawartpress.com/?p=3092;youtube;6oTz64k2Dqk;;;linear-gradient(135deg, #E5DDD4 0%, #FAF8F5 100%)
trailer-una-storia-sommersa-documentario-premio-morrione;documentary-films;VERO;;6;01/03/2015;Trailer Una Storia Sommersa - Documentario Premio Morrione;Trailer Una Storia Sommersa - Documentario Premio Morrione;Trailer Una Storia Sommersa - Documentario Premio Morrione;http://www.nawartpress.com/?p=582;youtube;74Yf50ZYWQo;;;linear-gradient(135deg, #E5DDD4 0%, #FAF8F5 100%)
scirocco-short-animation-film-realized-by-the-brush-bow-collective-and-leonard-ermel;documentary-films;VERO;;22;06/08/2018;Scirocco short animation film realized by the Brush & Bow collective and Leonard Ermel;Scirocco short animation film realized by the Brush & Bow collective and Leonard Ermel;Scirocco short animation film realized by the Brush & Bow collective and Leonard Ermel;http://www.nawartpress.com/?p=4020;youtube;bvb-jgQUTEU;;;linear-gradient(135deg, #E5DDD4 0%, #FAF8F5 100%)
far-right;documentary-films;VERO;VERO;1;;FAR RIGHT: A NEW FRIGHTENING NORMAL;FAR RIGHT: A NEW FRIGHTENING NORMAL;FAR RIGHT: A NEW FRIGHTENING NORMAL;https://www.youtube.com/watch?v=CUh5iNMIIrs;youtube;CUh5iNMIIrs;;;linear-gradient(135deg, #E5DDD4 0%, #FAF8F5 100%)
documentary-far-right-a-new-frightening-normal;documentary-films;VERO;;18;21/02/2018;Documentary : Far Right, a New Frightening Normal;Documentary : Far Right, a New Frightening Normal;Documentary : Far Right, a New Frightening Normal;http://www.nawartpress.com/?p=3841;youtube;CUh5iNMIIrs;;;linear-gradient(135deg, #E5DDD4 0%, #FAF8F5 100%)
english-mee-speaks-to-fabrunyer-aykol-female-co-mayor-of-the-municipality-of-mardin;multimedia-projects;VERO;VERO;12;14/06/2015;MEE speaks to Fabrunyer Aykol, female co-mayor of the municipality of Mardin;MEE speaks to Fabrunyer Aykol, female co-mayor of the municipality of Mardin;MEE speaks to Fabrunyer Aykol, female co-mayor of the municipality of Mardin;http://www.nawartpress.com/?p=1504;youtube;e0TXYoFF8Hg;;;linear-gradient(135deg, #E5DDD4 0%, #FAF8F5 100%)
documentario-una-storia-sommersa-premio-morrione;documentary-films;VERO;VERO;3;01/03/2015;Documentario: Una storia sommersa - Premio Morrione;Documentario: Una storia sommersa - Premio Morrione;Documentario: Una storia sommersa - Premio Morrione;http://www.nawartpress.com/?p=757;youtube;feVWYvSLKXA;;;linear-gradient(135deg, #E5DDD4 0%, #FAF8F5 100%)
english-egyptian-protesters-demand-end-to-sexual-harassment-middle-east-eye-tv;longform-reportage;VERO;;100;01/03/2015;Egyptian protesters demand end to sexual harassment - Middle East Eye TV;Egyptian protesters demand end to sexual harassment - Middle East Eye TV;Egyptian protesters demand end to sexual harassment - Middle East Eye TV;http://www.nawartpress.com/?p=615;youtube;G67VSwoMuTw;;;linear-gradient(135deg, #E5DDD4 0%, #FAF8F5 100%)
lesvos-dyarbakir-in-48h;migration-displacement;VERO;VERO;10;04/06/2015;Lesvos - Dyarbakir in 48h;Lesvos - Dyarbakir in 48h;Lesvos - Dyarbakir en 48h;http://www.nawartpress.com/?p=1444;youtube;O0MV1BAspos;;;linear-gradient(135deg, #E5DDD4 0%, #FAF8F5 100%)
francais-lesbos-lautre-porte-de-leurope-pour-des-refugies-en-perdition-orientxxi;migration-displacement;VERO;;13;31/07/2015;Francais Lesbos Lautre Porte De Leurope Pour Des Refugies En Perdition Orientxxi;Francais Lesbos Lautre Porte De Leurope Pour Des Refugies En Perdition Orientxxi;Francais Lesbos Lautre Porte De Leurope Pour Des Refugies En Perdition Orientxxi;http://orientxxi.info/;youtube;rxvMQHIGbIg;;http://orientxxi.info/local/cache-responsive/cache-560/875c320b357bac42c6b13e393d06d901.jpg;linear-gradient(135deg, #E5DDD4 0%, #FAF8F5 100%)
english-religious-tensions-simmer-in-egypts-minya-middle-east-eye-tv;longform-reportage;VERO;VERO;4;01/03/2015;http://youtu.be/sEQxNEx6N34;Religious tensions simmer in Egypt's Minya - Middle East Eye TV;http://youtu.be/sEQxNEx6N34;http://www.nawartpress.com/?p=588;youtube;sEQxNEx6N34;;;linear-gradient(135deg, #E5DDD4 0%, #FAF8F5 100%)
english-religious-tensions-simmer-in-egypts-minya-middle-east-eye;longform-reportage;VERO;VERO;7;01/03/2015;Religious tensions simmer in Egypt's Minya - Middle East Eye;Religious tensions simmer in Egypt's Minya - Middle East Eye;Religious tensions simmer in Egypt's Minya - Middle East Eye;http://www.middleeasteye.net/news/sisi-win-egypts-election-962-percent-vote;youtube;sEQxNEx6N34;;http://www.middleeasteye.net/sites/default/files/styles/main_image_article_page/public/main-images/2013_Egypt_churches.jpg;linear-gradient(135deg, #E5DDD4 0%, #FAF8F5 100%)
teaser-of-a-kurdish-women-dream-2015;documentary-films;VERO;;19;21/02/2018;Teaser of A Kurdish Women Dream, 2015;Teaser of A Kurdish Women Dream, 2015;Teaser of A Kurdish Women Dream, 2015;http://www.nawartpress.com/?p=3836;youtube;SfxbQSWhPqA;;;linear-gradient(135deg, #E5DDD4 0%, #FAF8F5 100%)
wild;documentary-films;VERO;VERO;8;24/03/2015;Wild, la Terapia del Viaggio;Wild, la Terapia del Viaggio;Wild, la Terapia del Viaggio;http://www.nawartpress.com/?p=1105;youtube;tn2-GSqPyl0;;http://www.nawartpress.com/wp-content/uploads/2015/03/Poster.jpg;linear-gradient(135deg, #E5DDD4 0%, #FAF8F5 100%)
world-refugee-day-2016-giz-video;documentary-films;VERO;;20;15/05/2018;Giornata Mondiale del Rifugiato 2016 - video GIZ;World Refugee Day 2016 - GIZ video;Journée Mondiale du Réfugié 2016 - vidéo GIZ;http://www.nawartpress.com/?p=3934;youtube;U5SDuLlF2z4;;;linear-gradient(135deg, #E5DDD4 0%, #FAF8F5 100%)
english-video-turks-kurds-express-their-fears-as-is-advances-on-kobane-middle-east-eye-tv;conflict-zones;VERO;VERO;2;01/03/2015;Video: Turks, Kurds express their fears as IS advances on Kobane - Middle East Eye TV;Video: Turks, Kurds express their fears as IS advances on Kobane - Middle East Eye TV;Video: Turks, Kurds express their fears as IS advances on Kobane - Middle East Eye TV;http://www.middleeasteye.net/news/turks-and-kurds-express-their-fears-islamic-state-advances-kobane-273753702#sthash.p1GIifYN.dpuf;youtube;XcrWwFHZ7jg;;http://www.middleeasteye.net/sites/default/files/styles/main_image_article_page/public/main-images/Kobane%20still.png;linear-gradient(135deg, #E5DDD4 0%, #FAF8F5 100%)
466;conflict-zones;VERO;VERO;5;01/03/2015;Siriani in fuga - Rainews24;Siriani in fuga - Rainews24;Siriani in fuga - Rainews24;http://www.nawartpress.com/?p=466;youtube;zKU1Wb3xZMc;;;linear-gradient(135deg, #E5DDD4 0%, #FAF8F5 100%)
italiano-siria-zahraa-e-nubl-villaggi-simbolo-dello-scontro-sunniti-sciiti;conflict-zones;VERO;VERO;1;25/02/2015;Siria, Zahraa e Nubl villaggi simbolo dello scontro sunniti-sciiti;Siria, Zahraa e Nubl villaggi simbolo dello scontro sunniti-sciiti;Siria, Zahraa e Nubl villaggi simbolo dello scontro sunniti-sciiti;http://www.nawartpress.com/?p=283;;;;http://nena-news.globalist.it/QFC/NEWS_72914.jpg;linear-gradient(135deg, #E5DDD4 0%, #FAF8F5 100%)
english-theatre-and-revolution-artshub;longform-reportage;VERO;VERO;2;28/02/2015;Theatre and revolution - ArtsHub;Theatre and revolution - ArtsHub;Theatre and revolution - ArtsHub;http://www.artshub.co.uk/news-article/features/public-policy/theatre-of-the-revolution-197246;;;;;linear-gradient(135deg, #E5DDD4 0%, #FAF8F5 100%)
sinai-deserto-e-affari-left;longform-reportage;VERO;VERO;3;28/02/2015;Sinai, deserto e affari - Left;Sinai, deserto e affari - Left;Sinai, deserto e affari - Left;http://www.nawartpress.com/?p=365;;;;http://www.nawartpress.com/wp-content/uploads/2015/02/image03.png;linear-gradient(135deg, #E5DDD4 0%, #FAF8F5 100%)
english-for-young-israelis-the-other-side-simply-does-not-exist-middle-east-eye;longform-reportage;;;4;01/03/2015;For young Israelis, the other side ‘simply does not exist’ - Middle East Eye;For young Israelis, the other side ‘simply does not exist’ - Middle East Eye;For young Israelis, the other side ‘simply does not exist’ - Middle East Eye;http://www.nawartpress.com/?p=678;;;;http://www.middleeasteye.net/sites/default/files/styles/main_image_article_page/public/Gi.jpg;linear-gradient(135deg, #E5DDD4 0%, #FAF8F5 100%)
holot-il-ghetto-nero-nigrizia;longform-reportage;;;5;01/03/2015;Holot, il ghetto nero - Nigrizia;Holot, il ghetto nero - Nigrizia;Holot, il ghetto nero - Nigrizia;http://www.nawartpress.com/?p=681;;;;http://www.nawartpress.com/wp-content/uploads/2015/03/10363320_10152884029353850_7252323587889770204_n.jpg;linear-gradient(135deg, #E5DDD4 0%, #FAF8F5 100%)
perche-la-turchia-lascia-che-lis-avanzi-su-kobane-pagina99;conflict-zones;;;6;01/03/2015;Perché la Turchia lascia che l'IS avanzi su Kobane - Pagina99;Perché la Turchia lascia che l'IS avanzi su Kobane - Pagina99;Perché la Turchia lascia che l'IS avanzi su Kobane - Pagina99;http://www.nawartpress.com/?p=693;;;;http://www.pagina99.it/upload/1412420830796.jpg;linear-gradient(135deg, #E5DDD4 0%, #FAF8F5 100%)
la-guerra-siriana-vista-dal-golan-sempre-piu-vicino-a-israele-europa;longform-reportage;;;7;01/03/2015;La guerra siriana vista dal Golan, sempre più vicino a Israele - Europa;La guerra siriana vista dal Golan, sempre più vicino a Israele - Europa;La guerra siriana vista dal Golan, sempre più vicino a Israele - Europa;http://www.europaquotidiano.it/2014/09/30/la-guerra-siriana-vista-dal-golan-sempre-piu-vicino-a-israele/;;;;;linear-gradient(135deg, #E5DDD4 0%, #FAF8F5 100%)
in-egitto-si-celebrano-le-finte-elezioni-il-caffe;longform-reportage;;;8;01/03/2015;In Egitto si celebrano le finte elezioni - Il Caffè;In Egitto si celebrano le finte elezioni - Il Caffè;In Egitto si celebrano le finte elezioni - Il Caffè;http://www.caffe.ch/stories/cronaca/47077_in_egitto_si_celebrano_le_finte_elezioni/;;;;http://new.caffe.ch/media/2014/05/22494_3_medium.jpg;linear-gradient(135deg, #E5DDD4 0%, #FAF8F5 100%)
le-donne-del-cairo-in-piazza-contro-gli-stupri-pagina-99;longform-reportage;;;9;01/03/2015;Le donne del Cairo in piazza contro gli stupri - Pagina 99;Le donne del Cairo in piazza contro gli stupri - Pagina 99;Le donne del Cairo in piazza contro gli stupri - Pagina 99;http://www.nawartpress.com/?p=636;;;;http://www.pagina99.it/upload/1402829299104.jpg;linear-gradient(135deg, #E5DDD4 0%, #FAF8F5 100%)
giornata-nazionale-contro-le-mutilazioni-genitali-femminili-in-egitto-donne-e-bambine-raccontano-il-loro-dolore-video-inchiesta-huffington-post;longform-reportage;;;10;01/03/2015;Giornata nazionale contro le mutilazioni genitali femminili: in Egitto donne e bambine raccontano il loro dolore (VIDEO INCHIESTA) - Huffington Post;Giornata nazionale contro le mutilazioni genitali femminili: in Egitto donne e bambine raccontano il loro dolore (VIDEO INCHIESTA) - Huffington Post;Giornata nazionale contro le mutilazioni genitali femminili: in Egitto donne e bambine raccontano il loro dolore (VIDEO INCHIESTA) - Huffington Post;http://www.huffingtonpost.it/2015/02/06/mgf-mutuilazioni-video-egitto_n_6628904.html;;;;;linear-gradient(135deg, #E5DDD4 0%, #FAF8F5 100%)
tra-i-profughi-curdi-di-kobane-fuggiti-in-poche-ore-combattiamo-per-liberare-la-citta-dallis-repubblica;longform-reportage;;;11;01/03/2015;"Tra i profughi curdi di Kobane, fuggiti in poche ore: ""Combattiamo per liberare la città dall'Is"" - Repubblica";"Tra i profughi curdi di Kobane, fuggiti in poche ore: ""Combattiamo per liberare la città dall'Is"" - Repubblica";"Tra i profughi curdi di Kobane, fuggiti in poche ore: ""Combattiamo per liberare la città dall'Is"" - Repubblica";http://www.nawartpress.com/?p=704;;;;http://www.repstatic.it/content/nazionale/img/2014/10/09/161743703-dde2f2cd-cddf-4408-ac00-0abc914a516a.jpg;linear-gradient(135deg, #E5DDD4 0%, #FAF8F5 100%)
al-sisi-incontra-renzi-in-egitto-proseguono-gli-arresti-di-massa-pagina-99;longform-reportage;;;12;01/03/2015;Al Sisi incontra Renzi, in Egitto proseguono gli arresti di massa - Pagina 99;Al Sisi incontra Renzi, in Egitto proseguono gli arresti di massa - Pagina 99;Al Sisi incontra Renzi, in Egitto proseguono gli arresti di massa - Pagina 99;http://www.nawartpress.com/?p=760;;;;http://www.pagina99.it/upload/1416865110771.jpg;linear-gradient(135deg, #E5DDD4 0%, #FAF8F5 100%)
francais-caricaturer-legypte-choisir;longform-reportage;;;13;01/03/2015;;;Caricaturer l'Egypte - Choisir;http://www.nawartpress.com/?p=780;;;;http://www.nawartpress.com/wp-content/uploads/2015/03/Schermata-2015-03-01-alle-21.18.05.png;linear-gradient(135deg, #E5DDD4 0%, #FAF8F5 100%)
egitto-dove-la-satira-puo-costare-la-liberta-repubblica;longform-reportage;;;14;01/03/2015;Egitto, dove la satira può costare la libertà - Repubblica;Egitto, dove la satira può costare la libertà - Repubblica;Egitto, dove la satira può costare la libertà - Repubblica;http://www.nawartpress.com/?p=784;;;;http://www.repstatic.it/content/nazionale/img/2015/01/13/232702782-de8c8283-cab0-4d30-8040-bd5b49e048ab.jpg;linear-gradient(135deg, #E5DDD4 0%, #FAF8F5 100%)
english-who-was-egypts-omar-mustafa-middle-east-eye;longform-reportage;;;15;01/03/2015;Who was Egypt's Omar Mustafa? - Middle East Eye;Who was Egypt's Omar Mustafa? - Middle East Eye;Who was Egypt's Omar Mustafa? - Middle East Eye;http://www.middleeasteye.net/news/egypt-issues-security-clearances-its-citizen-travellers-101752372;;;;http://www.middleeasteye.net/sites/default/files/styles/main_image_article_page/public/omar%20mustafa_0.jpg;linear-gradient(135deg, #E5DDD4 0%, #FAF8F5 100%)
francais-rojava-et-la-question-kurde-choisir;conflict-zones;;;16;01/03/2015;;;Rojava et la question kurde - Choisir;http://www.nawartpress.com/?p=723;;;;;linear-gradient(135deg, #E5DDD4 0%, #FAF8F5 100%)
francais-kobane-suruc-7-km-de-distance-2-pays-1-peuple-choisir;conflict-zones;;;17;01/03/2015;;;Kobane - Suruç : 7 km de distance, 2 pays, 1 peuple - Choisir;http://www.nawartpress.com/?p=727;;;;http://www.choisir.ch/images/actualites/KurdistanZeernews.jpg.jpg;linear-gradient(135deg, #E5DDD4 0%, #FAF8F5 100%)
legitto-bombarda-le-sue-case-per-combattere-i-jihadisti-pagina99;longform-reportage;;;18;01/03/2015;L’Egitto bombarda le sue case per combattere i jihadisti - Pagina99;L’Egitto bombarda le sue case per combattere i jihadisti - Pagina99;L’Egitto bombarda le sue case per combattere i jihadisti - Pagina99;http://www.nawartpress.com/?p=733;;;;;linear-gradient(135deg, #E5DDD4 0%, #FAF8F5 100%)
english-egypt-speak-day-1-and-2-of-vote-middle-east-eye;longform-reportage;;;19;01/03/2015;Egypt speak: day 1 and 2 of vote - Middle East Eye;Egypt speak: day 1 and 2 of vote - Middle East Eye;Egypt speak: day 1 and 2 of vote - Middle East Eye;http://www.nawartpress.com/?p=595;;;;http://www.middleeasteye.net/sites/default/files/styles/wysiwyg_large/public/images/Gamal%20Ahmed%20Abo%20Ghael%20and%20Sohaira%20Hussein%20Bitwaldy.jpg;linear-gradient(135deg, #E5DDD4 0%, #FAF8F5 100%)
francais-syriens-en-egypte-de-refugies-a-terroristes-choisir;longform-reportage;;;20;01/03/2015;;;"Syriens en Egypte. De réfugiés à ""terroristes"" - Choisir";http://www.nawartpress.com/?p=495;;;;;linear-gradient(135deg, #E5DDD4 0%, #FAF8F5 100%)
pronta-la-nuova-costituzione-la-tunisia-e-un-po-piu-laica-pagina99;longform-reportage;;;21;01/03/2015;Pronta la nuova costituzione  La Tunisia è un po' più laica - Pagina99;Pronta la nuova costituzione  La Tunisia è un po' più laica - Pagina99;Pronta la nuova costituzione  La Tunisia è un po' più laica - Pagina99;http://www.nawartpress.com/?p=498;;;;http://www.pagina99.it/upload/1389716091977.jpg;linear-gradient(135deg, #E5DDD4 0%, #FAF8F5 100%)
la-gatta-di-tunisi-che-lotta-contro-la-normalizzazione-pagina99;longform-reportage;;;22;01/03/2015;La gatta di Tunisi che lotta contro la normalizzazione - Pagina99;La gatta di Tunisi che lotta contro la normalizzazione - Pagina99;La gatta di Tunisi che lotta contro la normalizzazione - Pagina99;http://www.nawartpress.com/?p=501;;;;http://www.pagina99.it/upload/1390911338936.png;linear-gradient(135deg, #E5DDD4 0%, #FAF8F5 100%)
il-viaggio-della-morte-testimonianze-da-alessandria-degitto-paralleli;migration-displacement;;;23;01/03/2015;Il viaggio della morte. Testimonianze da Alessandria d'Egitto - Paralleli;Il viaggio della morte. Testimonianze da Alessandria d'Egitto - Paralleli;Il viaggio della morte. Testimonianze da Alessandria d'Egitto - Paralleli;http://www.mediteu.org/?q=users/paralleli;;;;http://www.mediteu.org/sites/default/files/styles/thumbnail/public/pictures/picture-100-1384623380.png;linear-gradient(135deg, #E5DDD4 0%, #FAF8F5 100%)
sotto-razzi-e-bombe-nel-kibbutz-di-beeri-il-caffe;longform-reportage;;;24;01/03/2015;"Sotto razzi e bombe nel kibbutz di ""Be'eri"" - Il Caffè";"Sotto razzi e bombe nel kibbutz di ""Be'eri"" - Il Caffè";"Sotto razzi e bombe nel kibbutz di ""Be'eri"" - Il Caffè";http://www.caffe.ch/stories/cronaca/47907_sotto_razzi_e_bombe_nel_kibbutz_di_beeri/;;;;http://new.caffe.ch/media/2014/08/22921_3_medium.jpg;linear-gradient(135deg, #E5DDD4 0%, #FAF8F5 100%)
lo-stato-islamico-del-sinai-una-guerra-alle-porte-di-israele-europa;longform-reportage;;;25;01/03/2015;Lo stato islamico del Sinai, una guerra alle porte di Israele - Europa;Lo stato islamico del Sinai, una guerra alle porte di Israele - Europa;Lo stato islamico del Sinai, una guerra alle porte di Israele - Europa;http://www.europaquotidiano.it/2013/10/06/egitto-sinai/;;;;http://www.europaquotidiano.it/wp-content/uploads/2013/10/sinai-guerra-egitto.jpg;linear-gradient(135deg, #E5DDD4 0%, #FAF8F5 100%)
la-disperazione-che-infrange-i-sogni-il-caffe;migration-displacement;;;26;01/03/2015;La disperazione che infrange i sogni - Il Caffè;La disperazione che infrange i sogni - Il Caffè;La disperazione che infrange i sogni - Il Caffè;http://www.caffe.ch/stories/cultura/45246_la_disperazione_che_infrange_i_sogni/;;;;http://new.caffe.ch/media/2013/11/21063_3_medium.jpg;linear-gradient(135deg, #E5DDD4 0%, #FAF8F5 100%)
egitto-con-gli-occhi-dei-ragazzi-di-strada-pagina99;longform-reportage;;;27;01/03/2015;Egitto con gli occhi dei ragazzi di strada - Pagina99;Egitto con gli occhi dei ragazzi di strada - Pagina99;Egitto con gli occhi dei ragazzi di strada - Pagina99;http://www.nawartpress.com/?p=505;;;;http://www.nawartpress.com/wp-content/uploads/2015/03/bambini-di-strata.jpg;linear-gradient(135deg, #E5DDD4 0%, #FAF8F5 100%)
risa-emozioni-silenzi-il-cairo-si-rivede-in-piazza-pagina99;longform-reportage;;;28;01/03/2015;Risa, emozioni, silenzi, Il Cairo si rivede in piazza - Pagina99;Risa, emozioni, silenzi, Il Cairo si rivede in piazza - Pagina99;Risa, emozioni, silenzi, Il Cairo si rivede in piazza - Pagina99;http://www.nawartpress.com/?p=541;;;;;linear-gradient(135deg, #E5DDD4 0%, #FAF8F5 100%)
una-piazza-da-oscar-left;longform-reportage;;;29;01/03/2015;Una piazza da Oscar - Left;Una piazza da Oscar - Left;Una piazza da Oscar - Left;http://www.nawartpress.com/?p=547;;;;;linear-gradient(135deg, #E5DDD4 0%, #FAF8F5 100%)
voto-dobbedienza-nigrizia;longform-reportage;;;30;01/03/2015;Voto d'obbedienza - Nigrizia;Voto d'obbedienza - Nigrizia;Voto d'obbedienza - Nigrizia;http://www.nawartpress.com/?p=579;;;;;linear-gradient(135deg, #E5DDD4 0%, #FAF8F5 100%)
la-rivoluzione-rubata-tre-anni-dopo-mubarak-pagina99;longform-reportage;;;31;01/03/2015;La rivoluzione rubata, tre anni dopo Mubarak - Pagina99;La rivoluzione rubata, tre anni dopo Mubarak - Pagina99;La rivoluzione rubata, tre anni dopo Mubarak - Pagina99;http://www.nawartpress.com/?p=535;;;;http://www.pagina99.it/upload/1390848458285.JPG;linear-gradient(135deg, #E5DDD4 0%, #FAF8F5 100%)
sinai-business-beduino-nigrizia;longform-reportage;;;32;01/03/2015;Sinai, business beduino - Nigrizia;Sinai, business beduino - Nigrizia;Sinai, business beduino - Nigrizia;http://www.nawartpress.com/?p=510;;;;;linear-gradient(135deg, #E5DDD4 0%, #FAF8F5 100%)
sinai-terra-di-nessuno-vita-trentina;longform-reportage;;;33;01/03/2015;Sinai, terra di nessuno - Vita Trentina;Sinai, terra di nessuno - Vita Trentina;Sinai, terra di nessuno - Vita Trentina;http://www.nawartpress.com/?p=513;;;;http://www.vitatrentina.it/var/vitatrentina/storage/images/rivista/2014/anno_89_-_n_10/pag_18_meridiani/sinai_terra_di_nessuno/egitto_-_il_confine_egitto-israele_nei_pressi_di_eilat._-_2008_-_wikipedia/2439447-1-ita-IT/egitto_-_il_confine_egitto-israele_nei_pressi_di_eilat._-_2008_-_wikipedia_large.jpg;linear-gradient(135deg, #E5DDD4 0%, #FAF8F5 100%)
english-the-priest-the-bedouins-and-the-kidnapped-africans-esquire;longform-reportage;;;34;01/03/2015;The Priest, The Bedouins and the Kidnapped Africans - Esquire;The Priest, The Bedouins and the Kidnapped Africans - Esquire;The Priest, The Bedouins and the Kidnapped Africans - Esquire;http://www.nawartpress.com/?p=518;;;;;linear-gradient(135deg, #E5DDD4 0%, #FAF8F5 100%)
curious;multimedia-projects;;;35;05/03/2015;MACLA artisti in collettivo;MACLA artisti in collettivo;MACLA collectif d'artistes;;;;;http://www.nawartpress.com/wp-content/uploads/2015/03/1-1.jpg;linear-gradient(135deg, #E5DDD4 0%, #FAF8F5 100%)
il-faraone-contro-il-califfo-nel-sinai-east;longform-reportage;;;36;13/03/2015;Il Faraone contro il Califfo nel Sinai - East;Il Faraone contro il Califfo nel Sinai - East;Il Faraone contro il Califfo nel Sinai - East;http://www.nawartpress.com/?p=1041;;;;http://www.eastonline.eu/images/copertine/xeast58it.jpg;linear-gradient(135deg, #E5DDD4 0%, #FAF8F5 100%)
donne-e-confini-nel-dibattito-allanpi-di-parma;longform-reportage;;;37;19/03/2015;Donne e confini nel dibattito all'ANPI di Parma;Donne e confini nel dibattito all'ANPI di Parma;Donne e confini nel dibattito all'ANPI di Parma;http://www.nawartpress.com/?p=1069;;;;http://www.nawartpress.com/wp-content/uploads/2015/03/IMG_5555-2.jpg;linear-gradient(135deg, #E5DDD4 0%, #FAF8F5 100%)
buon-newroz-il-capodanno-raccontato-da-aicha-attivista-curda;conflict-zones;;;38;22/03/2015;Buon Newroz! il capodanno raccontato da Aicha, attivista curda;Buon Newroz! il capodanno raccontato da Aicha, attivista curda;Buon Newroz! il capodanno raccontato da Aicha, attivista curda;http://www.nawartpress.com/?p=1094;;;;http://www.nawartpress.com/wp-content/uploads/2015/03/IMG_2389.jpg;linear-gradient(135deg, #E5DDD4 0%, #FAF8F5 100%)
non-un-numero-non-un-ombra-i-migranti-nei-dormitori-di-caritas;migration-displacement;;;39;23/03/2015;Non un numero, non un ombra: i migranti nei dormitori di Caritas;Non un numero, non un ombra: i migranti nei dormitori di Caritas;Non un numero, non un ombra: i migranti nei dormitori di Caritas;http://www.nawartpress.com/?p=1075;;;;http://www.nawartpress.com/wp-content/uploads/2015/03/migranti.jpg;linear-gradient(135deg, #E5DDD4 0%, #FAF8F5 100%)
grazie-a-chi-sta-contribuendo-a-rendere-questo-progetto-realta;TODO;;;40;01/04/2015;Manca sempre meno alla partenza!;Manca sempre meno alla partenza!;Manca sempre meno alla partenza!;http://www.nawartpress.com/nawart-press-su-limpresa-eccezionale-a-radio-popolare-podcast/;;;;http://www.nawartpress.com/wp-content/uploads/2015/03/team-work.jpg;linear-gradient(135deg, #E5DDD4 0%, #FAF8F5 100%)
un-artista-in-cammino-francis-alys-macla-lab;longform-reportage;;;41;05/04/2015;Un artista in cammino: Francis Alys - MACLA LAB;Un artista in cammino: Francis Alys - MACLA LAB;Un artiste sur le chemin: Francis Alys - MACLA LAB;http://www.nawartpress.com/?p=1167;;;;http://www.nawartpress.com/wp-content/uploads/2015/04/francis-alys.jpg;linear-gradient(135deg, #E5DDD4 0%, #FAF8F5 100%)
